"297";"All-Optical Signal Processing with New DPSK Based on Multi-dimensional Complex.";"2014";"Dan Zou|Yan Mei";"0";"2016-09-14 06:20:09";"All-optical Signal Processing with new DPSK based on Multi-dimensional Complex. D Zou, Y Mei -  , Parallel, Grid, Cloud and Internet Computing ( , 2014 - ieeexplore.ieee.org. Abstract—We studied all-optical parallel signal processing technology advantages,  analyzed XPM effect on the theoretical, and used pre-coded DPSK/DPSK modulation to  achieve hybrid multidimensional multiplexed signal processing, signal processing  .."
"298";"A Statistical Integrity Authentication Scheme without Grouping for Streaming Data.";"2014";"Xi Shi";"0";"2016-09-14 06:19:49";"A Statistical Integrity Authentication Scheme without Grouping for Streaming Data. X Shi - P2P, Parallel, Grid, Cloud and Internet Computing ( , 2014 - ieeexplore.ieee.org. Abstract—The development of the sensor networks has enabled increasing commercial or  scientific applications in which data are available as streams. And sometimes the core  security requirement of streaming data in WSNs is integrity rather than confidentiality.  .."
"299";"Reverse Analysis Method of Static XSS Defect Detection Technique Based on Database Query Language.";"2014";"Baojiang Cui|Baolian Long|Tingting Hou";"2";"2016-09-14 06:19:19";"Reverse Analysis Method of Static XSS Defect Detection Technique Based on Database Query Language. C Baojiang, L Baolian, H Tingting -   International Conference on, 2014 - ieeexplore.ieee.org. Abstract—Along with the wide use of web application, XSS vulnerability has become one of  the most common security problems and caused many serious losses. In this paper, on the  basis of database query language technique, we put forward a static analysis method of  .."
"300";"Emerging Technologies for Monitoring Behavioural and Psychological Symptoms of Dementia.";"2014";"Tarik Qassem|George Tadros|Philip Moore|Fatos Xhafa";"1";"2016-09-14 06:20:19";"Emerging Technologies for Monitoring Behavioural and Psychological Symptoms of Dementia. T Qassem, G Tadros, P Moore -   International Conference , 2014 - ieeexplore.ieee.org. (BPSD) are complex array of symptoms that have devastating impact on patients, carers and  their loved ones. In this paper we argue that with the combined use of pervasive computing  and big data, we could make significant progress in the diagnosis of the causes of BPSD,  .."
"301";"An Efficient Time-Frequency Domain Speech Perceptual Hashing Authentication Algorithm Based on Discrete Wavelet Transform.";"2014";"Qiu-Yu Zhang|Peng-Fei Xing|Yi-Bo Huang|Rui-Hong Dong|Zhong-Ping Yang";"0";"2016-09-14 06:20:29";"An Efficient Time-Frequency Domain Speech Perceptual Hashing Authentication Algorithm Based on Discrete Wavelet Transform. Z Qiu-Yu, X Peng-Fei, H Yi-Bo -   Internet Computing ( , 2014 - ieeexplore.ieee.org. Abstract—According to the situation that speech authentication algorithms are not  appropriated for real-time speech content authentication, a novel speech perceptual  hashing authentication algorithm based on discrete wavelet transform with combination of  .."
"302";"Evaluation of Division Based Broadcasting System Considering Additional Information.";"2014";"Yusuke Gotoh|Akihiro Kimura";"0";"2016-09-14 06:20:29";"Evaluation of Division Based Broadcasting System Considering Additional Information. Y Gotoh, A Kimura - P2P, Parallel, Grid, Cloud and Internet  , 2014 - ieeexplore.ieee.org. Abstract—Due to the recent popularization of IP multicast, the continuous broadcasting of  audio or video media data has attracted great attention. Although servers can concurrently  deliver data to many clients, clients have to wait until their data are broadcast. In division  .."
"303";"Research on Online Measurement Method of Smartphone Energy Consumption.";"2014";"Jie Ma|Haiyang Yu|Xiaoli Gong|Xiaoyu Zhang";"0";"2016-09-14 06:19:59";"Research on Online Measurement Method of Smartphone Energy Consumption. J Ma, H Yu, X Gong, X Zhang -  , Cloud and Internet Computing  , 2014 - ieeexplore.ieee.org. Abstract—Online power measurement is one of the power measurements in smartphones  which would allow us to measure the energy consumption of smartphones without using  external devices. This online method depends on a built-in BMU (Battery Monitoring Unit).  .."
"304";"A Review: The Effects of Imperfect Data on Incremental Decision Tree.";"2014";"Hang Yang|Aidong Xu|Huajun Chen|Cai Yuan";"0";"2016-09-14 06:20:49";"A Review: The Effects of Imperfect Data on Incremental Decision Tree. H Yang, A Xu, H Chen, C Yuan -  Cloud and Internet Computing , 2014 - ieeexplore.ieee.org. Abstract Decision tree, as one of the most widely used methods in data mining, has been  used in many realistic application. Incremental decision tree handles streaming data  scenario that is applicable for big data analysis. However, imperfect data are unavoidable  .."
"305";"JavaScript Malicious Codes Analysis Based on Naive Bayes Classification.";"2014";"Yongle Hao|Hongliang Liang|Daijie Zhang|Qian Zhao|Baojiang Cui";"0";"2016-09-14 06:20:39";"JavaScript Malicious Codes Analysis Based on Naive Bayes Classification. Y Hao, H Liang, D Zhang, Q Zhao -   International Conference , 2014 - ieeexplore.ieee.org. Abstract: Given the security threats of JavaScript malicious codes attacks in the Internet  environment, this paper presents a method that uses the Naive Bayes classification to  analyze JavaScript malicious codes. The method uses many malicious and normal  .."
"306";"Improving Differential Evolution with Ring Topology-Based Mutation Operators.";"2014";"Jingliang Liao|Yiqiao Cai|Yonghong Chen|Tian Wang|Hui Tian";"0";"2016-09-14 06:19:59";"Improving Differential Evolution with Ring Topology-Based Mutation Operators. J Liao, Y Cai, Y Chen, T Wang -   International Conference , 2014 - ieeexplore.ieee.org. Abstract—Differential evolution (DE) has been proven to be a simple and powerful  evolutionary algorithm, and obtains many successful applications in scientific and  engineering fields. The mutation strategy plays the key role in DE for finding global  .."
"307";"Design and Implementation of WPF-based Mini OA System.";"2014";"Cheng Wang|Zhixiao Lin|Fangsheng Guotang|Lixiao Zheng|Zhigang Zhu";"0";"2016-09-14 06:20:19";"Design and Implementation of WPF-based Mini OA System. C Wang, Z Lin, F Guotang, L Zheng -  International Conference , 2014 - ieeexplore.ieee.org. Abstract—In order to build a practical mini OA system for small and medium enterprise, key  business, overall requirement, functional requirements and non-functional requirements of  Yardi Kooboo (Xiamen) Technology Co. Ltd. are analyzed after understanding the  .."
"308";"Intelligent Bio-inspired Approach for Secrecy Management in the Cloud.";"2014";"Marek R. Ogiela|Lidia Ogiela|Urszula Ogiela";"0";"2016-09-14 06:19:49";"Intelligent Bio-inspired Approach for Secrecy Management in the Cloud. MR Ogiela, L Ogiela, U Ogiela -  , Cloud and Internet Computing , 2014 - ieeexplore.ieee.org. Abstract—In the paper will be presented some advances in cryptobiometric procedures used  for encryption and division of secret data in the cloud. A novel solutions of the secret data  sharing will be presented, based on the concept of mathematical linguistics, which are  .."
"309";"Self-Certified Public Auditing for Data Integrity in Cloud Storage.";"2014";"Jianhong Zhang|Weina Zeng";"1";"2016-09-14 06:20:49";"Self-Certified Public Auditing for Data Integrity in Cloud Storage. J Zhang, W Zeng - P2P, Parallel, Grid, Cloud and Internet  , 2014 - ieeexplore.ieee.org. Abstract—In cloud storage, after data file is outsourced, data owner no longer physical  controls over the storage. To efficiently verify these data integrity, several public auditing  schemes for data integrity checking were proposed to achieve data integrity checking. The  .."
"310";"The Chinese Conceptual Graph Matching Algorithm Based on Conceptual Sub-graph Weight Self-Adjustment.";"2014";"Hui Zeng|Liyan Xiong|Jianjun Chen";"0";"2016-09-14 06:19:49";"The Chinese Conceptual Graph Matching Algorithm Based on Conceptual Sub-graph Weight Self-Adjustment. H Zeng, L Xiong, J Chen -  , Grid, Cloud and Internet Computing , 2014 - ieeexplore.ieee.org. Abstract—Semantic computing is an important task in the research of natural language  processing. For the problem of the inaccurate conceptual graph matching, this paper  proposed the algorithm based on Conceptual sub-Graph weight self-adjustment. Based  .."
"311";"A Dynamic Re-encrypted Ciphertext-Policy Attributed-Based Encryption Scheme for Cloud Storage.";"2014";"Lequn Mo|Fuyong Lin";"0";"2016-09-14 06:19:59";"A dynamic re-encrypted ciphertext-policy attributed-based encryption scheme for cloud storage. L Mo, F Lin - P2P, Parallel, Grid, Cloud and Internet Computing  , 2014 - ieeexplore.ieee.org. Abstract—In this paper a dynamic re-encrypted ciphertext-policy attributed-based encryption  (DRCP-ABE) scheme is introduced to keep the sharing data safe for cloud storage, which is  designed to delegate the cloud service provider to reencrypt the sharing data and send  .."
"312";"Optimizational Method of HBase Multi-dimensional Data Query Based on Hilbert Space-Filling Curve.";"2014";"Qingcheng Li|Ye Lu|Xiaoli Gong|Jin Zhang";"1";"2016-09-14 06:20:29";"Optimizational Method of HBase Multi-dimensional Data Query Based on Hilbert Space-Filling Curve. Q Li, Y Lu, X Gong, J Zhang -  , Parallel, Grid, Cloud and Internet , 2014 - ieeexplore.ieee.org. Abstract—HBase distributed database technology has been widely used in missive data  processing. The problem of the efficiency of multi-dimensional data query which is caused  by its single primary key indexing becomes more apparent. This paper proposed and  .."
"313";"Computer-Aided Enterprise Management.";"2014";"Lidia Ogiela|Marek R. Ogiela";"0";"2016-09-14 06:20:39";"Computer-Aided Enterprise Management. L Ogiela, MR Ogiela - P2P, Parallel, Grid, Cloud and Internet  , 2014 - ieeexplore.ieee.org. Abstract—In this paper the semantic analysis procedures will be adopted for enterprise  management and strategic-decision making tasks, using cognitive information systems.  These systems are used to perform the semantic analysis of the enterprise financial  .."
"314";"A Multi-attribute Vertical Handover Algorithm Based on Adaptive Weight in Heterogeneous Wireless Network.";"2014";"Feng Dan|Yajie Ma|Fengxing Zhou|Shaowu Lu";"1";"2016-09-14 06:19:29";"A Multi-attribute Vertical Handover Algorithm Based on Adaptive Weight in Heterogeneous Wireless Network. D Feng, M Yajie, Z Fengxing -   International Conference , 2014 - ieeexplore.ieee.org. Abstract—As one of the key issues of users' mobility management in next generation of  heterogeneous wireless network, vertical handover has received extensive attention in  academic and industrial circles. With the development of mobile terminals, mobile users  .."
"315";"A Network Gene-Based Framework for Detecting Advanced Persistent Threats.";"2014";"Yuan Wang|Yongjun Wang|Jing Liu|Zhijian Huang";"2";"2016-09-14 06:19:09";"A Network Gene-Based Framework for Detecting Advanced Persistent Threats. Y Wang, Y Wang, J Liu, Z Huang -   International Conference on, 2014 - ieeexplore.ieee.org. Abstract—Advanced Persistent Threat (APT) poses a serious threat to cyber security, and its  unique high unpredictability, deep concealment and grave harmfulness make the traditional  network monitoring technology facing unprecedented challenges in the background of  .."
"316";"Security Analysis of TAU Procedure in LTE Network.";"2014";"Li Qiang|Wenan Zhou|Baojiang Cui|Liu Na";"1";"2016-09-14 06:19:19";"Security Analysis of TAU Procedure in LTE Network. L Qiang, W Zhou, B Cui, L Na -  , Cloud and Internet Computing  , 2014 - ieeexplore.ieee.org. Abstract—LTE has become a commercial communication technology worldwide, and its  security issues are attracting more and more attention. Tracking Area Update (TAU) is a  series of procedures performed by LTE system when users update Tracking Area (TA).  .."
"317";"Mobile Security Apps: Loyal Gaurds or Hypocritical Thieves?";"2014";"Yonglin Sun|Yongjun Wang|Xiaobin Wang";"1";"2016-09-14 06:19:39";"Mobile Security Apps: Loyal Gaurds or Hypocritical Thieves?. Y Sun, Y Wang, X Wang -  , Grid, Cloud and Internet Computing  , 2014 - ieeexplore.ieee.org. Abstract—Mobile security app plays an important role in managing third-party apps and  protecting user's data on smart phone. However, who can guarantee mobile security app's  loyalty, or who can determine a given mobile security app is not a hypocritical thief? Thus,  .."
"318";"Analysis on Password Protection in Android Applications.";"2014";"Shuai Shao|Guowei Dong|Tao Guo|Tianchang Tang|Chenjie Shi";"0";"2016-09-14 06:19:49";"Analysis on password protection in Android applications. S Shuai, D Guowei, G Tao -   Internet Computing ( , 2014 - ieeexplore.ieee.org. Abstract—Although there has been much research on the leakage of sensitive data in  Android applications, most of the existing research focus on how to detect the malware or  adware that are intentionally collect user privacy. There are not many researches on  .."
"319";"Interactive Headphones for a Cloud 3D Audio Application.";"2014";"Daniela D'Auria|Dario Di Mauro|Davide Maria Calandra|Francesco Cutugno";"0";"2016-09-14 06:19:59";"Interactive Headphones for a Cloud 3D Audio Application. D D'Auria, D Di Mauro, DM Calandra -   Internet Computing ( , 2014 - ieeexplore.ieee.org. Abstract Spatial dimensionality is one of the main features of the physical environment in  which humans live. When we think about 3D, we usually refer to 3D video, even if it is not the  only existing channel of natural interaction. In this paper, we present an interaction system  .."
"320";"An Evaluation of a P2P Sensor Data Streaming System Considering the Number of Hops on the PIAX Testbed.";"2014";"Yoshimasa Ishi|Tomoya Kawakami|Tomoki Yoshihisa|Yuuichi Teranishi";"0";"2016-09-14 06:20:09";"An Evaluation of a P2P Sensor Data Streaming System Considering the Number of Hops on the PIAX Testbed. Y Ishi, T Kawakami, T Yoshihisa -  and Internet Computing , 2014 - ieeexplore.ieee.org. Abstract—Our research team proposed some peer-to-peer technique based on sensor data  streaming methods named LCF, LLF and LLF-H for distributing communication loads when  delivering sensor data streams with different data collection cycles. The LCF method and  .."
"321";"A Verifiable Multi-recipient Encryption Scheme from Multilinear Maps.";"2014";"Zhengjun Jing|Guoping Jiang|Chunsheng Gu";"1";"2016-09-14 06:19:49";"A Verifiable Multi-recipient Encryption Scheme from Multilinear Maps. Z Jing, G Jiang, C Gu - P2P, Parallel, Grid, Cloud and Internet  , 2014 - ieeexplore.ieee.org. Abstract—Multi-recipient encryption is an important public key cryptosystem, which can be  applied for a variety of purposes, such as broadcasting data. In order to design an secure  multi-recipient public key encryption (MRPKE) in post-quantum era, in this paper, we  .."
"322";"Static-Dynamic Control Flow Integrity.";"2014";"Xiaolong Liu|Qiang Wei|Ziwei Ye";"1";"2016-09-14 06:19:39";"Static-Dynamic Control Flow Integrity. X Liu, Q Wei, Z Ye - P2P, Parallel, Grid, Cloud and Internet  , 2014 - ieeexplore.ieee.org. We evaluate our prototype implementation for Internet Explorer8 browser on Windows XP,  which faces serious security threats since April 8, 2014. SDCFI protects most indirect call  instructions in msthml. dll, and has low runtime overhead of 1.48% on average.  .."
"323";"Challenges and Trends of Big Data Analytics.";"2014";"Hui Li|Xin Lu";"3";"2016-09-14 06:18:59";"Challenges and Trends of Big Data Analytics. H Li, X Lü - P2P, Parallel, Grid, Cloud and Internet Computing ( , 2014 - ieeexplore.ieee.org. Abstract—This article provides an overview of the challenges of big data, in the aspects of  data scale, data heterogeneity, data timeliness, and demand for deep analyzing, in  correspondence with four features of big data. It also presents an overview of trends of big  .."
"324";"Malicious Code Detection Using Opcode Running Tree Representation.";"2014";"Yuxin Ding|Wei Dai|Yibin Zhang|Chenglong Xue";"0";"2016-09-14 06:20:09";"Malicious Code Detection Using Opcode Running Tree Representation. D Yuxin, D Wei, Z Yibin -   International Conference  , 2014 - ieeexplore.ieee.org. Abstract—An opcode behavior based method is proposed to detect malware. Opcode  behaviors are represented as opcode sequences from a decompiled executable. To  accurately describe the malware behaviors, we construct the opcode running tree to  .."
"325";"HPC Cloud Pills: On-Demand Deployment and Execution of HPC Application in Cloud Environments.";"2014";"Pietro Ruiu|Olivier Terzo|Giuseppe Carlino|Rossella Prandi|Alberto Falzone|Paolo Maggi|Livia Torterolo|Enrico Usai|Gianpaolo Perego";"1";"2016-09-14 06:19:29";"HPC Cloud Pills: On-Demand Deployment and Execution of HPC Application in Cloud Environments. P Ruiu, O Terzo, G Carlino, R Prandi -   Internet Computing ( , 2014 - ieeexplore.ieee.org. Abstract—High Performance Computing (HPC) is a valuable instrument in many areas of  scientific research and industrial production. However, due to the high investment costs for  its implementation, its diffusion is often restricted to large research centres or medium to  .."
"326";"Vinyl Acetate Polymerization Rate Prediction Based on FOA GNN.";"2014";"Yang Jing|Zeng Hui|Huang Jiangping";"1";"2016-09-14 06:19:29";"Vinyl Acetate Polymerization Rate Prediction Based on FOA GNN. Y Jing, Z Hui, H Jiangping -  Grid, Cloud and Internet Computing , 2014 - ieeexplore.ieee.org. Abstract—The vinyl acetate polymerization rate is an important quality index in the  production of polyvinyl alcohol. However, for it can not be measured online, the polyvinyl  alcohol quality can not be controlled effectively. As a novel metaheuristic and evolutional  .."
"327";"Photon Pulses based Heterodyne Detection Precision Ranging System.";"2014";"Li-Xia Lei|Yue-Jin Zhang";"0";"2016-09-14 06:20:09";"Photon Pulses based Heterodyne Detection Precision Ranging System. LX Lei, YJ Zhang - P2P, Parallel, Grid, Cloud and Internet  , 2014 - ieeexplore.ieee.org. Abstract—A system architecture design photon pulses heterodyne detection system, using  the photon pulse photon detection heterodyne principle and statistical theory, based on the  establishment of a photon pulses theoretical models ranging accuracy heterodyne  .."
"328";"New Evaluation Criterion of File Replicas Placement for Replication Strategies in Data Grids.";"2014";"C. Hamdeni|Tarek Hamrouni|Faouzi Ben Charrada";"2";"2016-09-14 06:19:09";"New evaluation criterion of file replicas placement for replication strategies in data grids. C Hamdeni, T Hamrouni -   International Conference , 2014 - ieeexplore.ieee.org. Abstract—Data grids provide distributed resources for dealing with large scale applications  generating huge volume of data that require to be efficiently managed, shared and  analyzed. Data replication is a useful technique to solve these tasks since it allows  .."
"329";"Distance-Bounding Protocol with Time-Stamped Authentication for RFID.";"2014";"Guo-Heng Wei|Huan-Guo Zhang|Zheng Li";"0";"2016-09-14 06:20:29";"Distance-bounding protocol with time-stamped authentication for RFID. W Guo-Heng, Z Huan-Guo -   International Conference  , 2014 - ieeexplore.ieee.org. Abstract Relay attack is one of the most challenging threats that RFID will have to face now.  Distance bounding protocols form a family of challenge-response authentication protocols  and confirm the round-trip time at the Rapid Bit Exchange phase that have been  .."
"330";"Automatic Population of Italian Medical Thesauri: A Morphosemantic Approach.";"2014";"Flora Amato|Annibale Elia|Alessandro Maisto|Antonino Mazzeo|Serena Pelosi";"0";"2016-09-14 06:20:10";"Automatic Population of Italian Medical Thesauri: A Morphosemantic Approach. F Amato, A Elia, A Maisto, A Mazzeo -  and Internet Computing , 2014 - ieeexplore.ieee.org. Abstract—In the age of Semantic Web, one of the most valuable challenges is the one  connected with the information extraction from raw data. Information must be managed with  sophisticated linguistic and computational architectures, which are able to approach the  .."
"331";"A Security Enhanced IEEE1588 Protocol for Deep-Space Environment.";"2014";"Zijing Cheng|Lei He|Jingling Zhao|Kai Lin|Baojiang Cui";"1";"2016-09-14 06:19:19";"A Security Enhanced IEEE1588 Protocol for Deep-Space Environment. Z Cheng, L He, J Zhao, K Lin -   International Conference  , 2014 - ieeexplore.ieee.org. Abstract—With the continuous development of the space technology, increasing  communication between spacecrafts. To ensure the spacecrafts keep a uniform time  standard, time synchronization protocol plays an crucial role. Taking account the  .."
"332";"Static Compliance Checking beyond Separation of Duty Constraints.";"2014";"Yang Bo|Chunhe Xia|Yang Luo|Qing Tang";"0";"2016-09-14 06:19:59";"Static Compliance Checking beyond Separation of Duty Constraints. Y Bo, C Xia, Y Luo, Q Tang -  , Parallel, Grid, Cloud and Internet  , 2014 - ieeexplore.ieee.org. Abstract—in many application domains, processes often have to comply with business level  rules and policies, called compliance constraint. Separation of duty requirement is one of  such constraint, and enhancement measures are taken to make sure the business  .."
"333";"An Automatic Method for Deriving OWL Ontologies from XML Documents.";"2014";"Aniello Minutolo|Angelo Esposito|Mario Ciampi|Massimo Esposito|G. Cassetti";"0";"2016-09-14 06:19:59";"An automatic method for deriving OWL ontologies from XML documents. A Minutolo, A Esposito, M Ciampi -   Internet Computing ( , 2014 - ieeexplore.ieee.org. Abstract—In the last decade, the field of Big Data Analytics has become increasingly  important in both the academic and the business communities. Typically, data are mostly  structured, collected by different actors through various heterogeneous and distributed  .."
"334";"An Enhancement for Key Management in LTE/SAE X2 Handover Based on Ciphering Key Parameters.";"2014";"Qinshu Xiao|Wenan Zhou|Baojiang Cui|Lingrong Li";"3";"2016-09-14 06:19:09";"An Enhancement for Key Management in LTE/SAE X2 Handover Based on Ciphering Key Parameters. Q Xiao, B Cui, L Li - P2P, Parallel, Grid, Cloud and Internet  , 2014 - ieeexplore.ieee.org. Abstract—The security of handover key management in Long Term Evolution (LTE)/System  Architecture Evolution (SAE) has been a popular topic in recent years. In this paper we first  describe the security architecture and key hierarchy of LTE/SAE, clarifying security  .."
"335";"Design of a New EPON Connection Automatic Protection System.";"2014";"Li-Xia Lei|Yue-Jin Zhang";"0";"2016-09-14 06:20:19";"Design of a New EPON Connection Automatic Protection System. LX Lei, Z Yue-Jin - P2P, Parallel, Grid, Cloud and Internet  , 2014 - ieeexplore.ieee.org. Abstract—Automatic protection mechanism designed a new type of connection-oriented  Ethernet passive optical networks (EPON), including functional architecture, fault  management, and build a network of automatic protection mechanism to test the function  .."
"336";"Performance of Space Network Time Synchronization Protocol in Proximity Link.";"2014";"Xiang Lu|Jianxun Liu";"0";"2016-09-14 06:19:59";"Performance of Space Network Time Synchronization Protocol in Proximity Link. X Lu, J Liu - P2P, Parallel, Grid, Cloud and Internet Computing  , 2014 - ieeexplore.ieee.org. Abstract—In this work, we consider a space network time synchronization protocol which is  based on time information exchanges similar to Network Time Protocol. Further, we analyze  the performance of this time protocol due to relative motion with two spacecraft through  .."
"337";"OpenSSL HeartBleed: Security Management of Implements of Basic Protocols.";"2014";"Yongle Hao|Yizhen Jia|Baojiang Cui|Wei Xin|Dehu Meng";"1";"2016-09-14 06:19:19";"Openssl heartbleed: Security management of implements of basic protocols. Y Hao, Y Jia, B Cui, W Xin -   International Conference  , 2014 - ieeexplore.ieee.org. Abstract With the rapid development of information technology, information security  management is ever more important. OpenSSL security incident told us, there's distinct  disadvantages of security management of current hierarchical structure, the software and  .."
"338";"GMCR: A Novel Scheme for Improving Quality of Service of Live Streaming.";"2014";"Guomin Zhang|Chao Hu|Na Wang|Xianglin Wei|Chang-you Xing";"0";"2016-09-14 06:20:19";"GMCR: A Novel Scheme for Improving Quality of Service of Live Streaming. G Zhang, C Hu, N Wang, X Wei -   International Conference , 2014 - ieeexplore.ieee.org. Internet applications which develop rapidly in the past decade. However, some common  problems, such as long startup delay and unsmooth playback, seriously restrict user's  experience on live streaming. In this paper, we propose a novel but simple scheme,  .."
"339";"An Improved Image Encoding Algorithm Based on EZW and Huffman Joint Encoding.";"2014";"Zhang Wei";"0";"2016-09-14 06:20:49";"An Improved Image Encoding Algorithm Based on EZW and Huffman Joint Encoding. Z Wei - P2P, Parallel, Grid, Cloud and Internet Computing ( , 2014 - ieeexplore.ieee.org. Abstract: Embedded zero tree wavelet coding (EZW) is an effective image coding algorithm,  Study on the output stream of P, N, T, Z symbol, they are appeared with inequality  probability. In order to reduce the desired number of digits used in coding, this paper  .."
