"613";"Efficient Algorithms for Strong Local Consistencies in Constraint Satisfaction Problems.";"2013";"Anastasia Paparrizou";"0";"2016-06-18 13:53:15";"Efficient Algorithms for Strong Local Consistencies in Constraint Satisfaction Problems. A Paparrizou - AAAI, 2013 - users.uowm.gr. Abstract The existing complete methods for solving Constraint Satisfaction Problems (CSPs)  are usually based on a combination of exhaustive search and constraint propagation  techniques for the reduction of the search space. Such propagation techniques are the  .."
"614";"Autonomous Agents in Future Energy Markets: The 2012 Power Trading Agent Competition.";"2013";"Wolfgang Ketter|Markus Peters|John Collins";"20";"2016-06-18 06:31:05";"Autonomous agents in future energy markets: the 2012 power trading agent competition. W Ketter, M Peters, J Collins -   Benelux Conference on Artificial  , 2013 - repository.tudelft.nl. Energy markets worldwide are undergoing momentous change. In the European Union  alone, required investments into the smart electric grid of the future are projected to run up to  more than two trillion Euro between 2011 and 2050, with total energy systems cost rising  .."
"615";"Multiagent Knowledge and Belief Change in the Situation Calculus.";"2013";"Liangda Fang|Yongmei Liu 0001";"9";"2016-09-05 05:27:55";"Multiagent Knowledge and Belief Change in the Situation Calculus. L Fang, Y Liu - AAAI, 2013 - lic.sysu.edu.cn. Abstract Belief change is an important research topic in AI. It becomes more perplexing in  multi-agent settings, since the action of an agent may be partially observable to other  agents. In this paper, we present a general approach to reasoning about actions and  .."
"616";"Reciprocal Hash Tables for Nearest Neighbor Search.";"2013";"Xianglong Liu|Junfeng He|Bo Lang";"16";"2016-09-05 04:55:54";"Reciprocal Hash Tables for Nearest Neighbor Search. X Liu, J He, B Lang - AAAI, 2013 - pdfs.semanticscholar.org. Abstract Recent years have witnessed the success of hashing techniques in approximate  nearest neighbor search. In practice, multiple hash tables are usually employed to retrieve  more desired results from all hit buckets of each table. However, there are rare works  .."
"617";"Bundling Attacks in Judgment Aggregation.";"2013";"Noga Alon|Dvir Falik|Reshef Meir|Moshe Tennenholtz";"9";"2016-06-18 13:52:55";"Bundling Attacks in Judgment Aggregation. N Alon, D Falik, R Meir, M Tennenholtz - AAAI, 2013 - Citeseer. Abstract We consider judgment aggregation over multiple independent issues, where the  chairperson has her own opinion, and can try to bias the outcome by bundling several  issues together. Since for each bundle judges must give a uniform answer on all issues,  .."
"618";"Understanding Descriptions of Visual Scenes Using Graph Grammars.";"2013";"Daniel Bauer";"0";"2016-09-05 08:32:55";"Understanding Descriptions of Visual Scenes Using Graph Grammars. D Bauer - AAAI, 2013 - pdfs.semanticscholar.org. Teaching computers to understand the meaning of natural language text has long been an  important goal for Artificial Intelligence. The focus of my work is on the interpretation of  descriptions of visual scenes such as 'A man is sitting on a chair and using the computer'.  .."
"619";"A Tensor-Variate Gaussian Process for Classification of Multidimensional Structured Data.";"2013";"Qibin Zhao|Liqing Zhang|Andrzej Cichocki";"4";"2016-06-18 13:53:25";"A Tensor-Variate Gaussian Process for Classification of Multidimensional Structured Data. Q Zhao, L Zhang, A Cichocki - AAAI, 2013 - bcmi.sjtu.edu.cn. Abstract As tensors provide a natural and efficient representation of multidimensional  structured data, in this paper, we consider probabilistic multinomial probit classification for  tensor-variate inputs with Gaussian processes (GP) priors placed over the latent function.  .."
"620";"Online Lazy Updates for Portfolio Selection with Transaction Costs.";"2013";"Puja Das|Nicholas Johnson|Arindam Banerjee";"6";"2016-06-18 13:53:05";"Online Lazy Updates for Portfolio Selection with Transaction Costs. P Das, N Johnson, A Banerjee - AAAI, 2013 - www-users.cs.umn.edu. Abstract A major challenge for stochastic optimization is the cost of updating model  parameters especially when the number of parameters is large. Updating parameters  frequently can prove to be computationally or monetarily expensive. In this paper, we  .."
"621";"On the Value of Using Group Discounts under Price Competition.";"2013";"Reshef Meir|Tyler Lu|Moshe Tennenholtz|Craig Boutilier";"10";"2016-06-18 14:03:53";"On the value of using group discounts under price competition. R Meir, T Lu, M Tennenholtz, C Boutilier - Artificial Intelligence, 2014 - Elsevier. Abstract The increasing use of group discounts has provided opportunities for buying groups  with diverse preferences to coordinate their behavior in order to exploit the best offers from  multiple vendors. We analyze this problem from the viewpoint of the vendors, asking  .."
"622";"Ranking Scientific Articles by Exploiting Citations, Authors, Journals, and Time Information.";"2013";"Yujing Wang|Yunhai Tong|Ming Zeng";"9";"2016-09-05 06:22:32";"Ranking Scientific Articles by Exploiting Citations, Authors, Journals, and Time Information. Y Wang, Y Tong, M Zeng - AAAI, 2013 - pdfs.semanticscholar.org. Abstract Ranking scientific articles is an important but challenging task, partly due to the  dynamic nature of the evolving publication network. In this paper, we mainly focus on two  problems:(1) how to rank articles in the heterogeneous network; and (2) how to use time  .."
"623";"Graph Traversal Methods for Reasoning in Large Knowledge-Based Systems.";"2013";"Abhishek B. Sharma|Kenneth D. Forbus";"1";"2016-06-18 13:53:47";"Graph Traversal Methods for Reasoning in Large Knowledge-Based Systems. AB Sharma, KD Forbus - AAAI, 2013 - qrg.northwestern.edu. Abstract Commonsense reasoning at scale is a core problem for cognitive systems. In this  paper, we discuss two ways in which heuristic graph traversal methods can be used to  generate plausible inference chains. First, we discuss how Cyc's predicate-type hierarchy  .."
"624";"Learning Integrated Symbolic and Continuous Action Models for Continuous Domains.";"2013";"Joseph Zhen Ying Xu|John E. Laird";"0";"2016-06-18 13:53:25";"Learning Integrated Symbolic and Continuous Action Models for Continuous Domains. JZY Xu, JE Laird - AAAI, 2013 - blog.narotama.ac.id. Abstract Long-living autonomous agents must be able to learn to perform competently in  novel environments. One important aspect of competence is the ability to plan, which entails  the ability to learn models of the agent's own actions and their effects on the environment.  .."
"625";"Model-Lite Case-Based Planning.";"2013";"Hankz Hankui Zhuo|Tuan Anh Nguyen 0001|Subbarao Kambhampati";"7";"2016-06-18 06:44:13";"Model-lite case-based planning. HH Zhuo, S Kambhampati, T Nguyen - arXiv preprint arXiv:1207.6713, 2012 - arxiv.org. Abstract: There is increasing awareness in the planning community that depending on  complete models impedes the applicability of planning technology in many real world  domains where the burden of specifying complete domain models is too high. In this  .."
"626";"Distribution Kernel Methods for Multiple-Instance Learning.";"2013";"Gary Doran";"1";"2016-06-18 13:53:15";"Distribution Kernel Methods for Multiple-Instance Learning. G Doran - AAAI, 2013 - engr.case.edu. Abstract I propose to investigate learning in the multiple-instance (MI) framework as a  problem of learning from distributions. In many MI applications, bags of instances can be  thought of as samples from bag-generating distributions. Recent kernel approaches for  .."
"627";"Multi-Armed Bandit with Budget Constraint and Variable Costs.";"2013";"Wenkui Ding|Tao Qin|Xu-Dong Zhang|Tie-Yan Liu";"28";"2016-08-29 04:43:37";"Multi-Armed Bandit with Budget Constraint and Variable Costs. W Ding, T Qin, XD Zhang, TY Liu - AAAI, 2013 - msr-waypoint.com. Abstract We study the multi-armed bandit problems with budget constraint and variable costs  (MAB-BV). In this setting, pulling an arm will receive a random reward together with a  random cost, and the objective of an algorithm is to pull a sequence of arms in order to  .."
"628";"The Automated Acquisition of Suggestions from Tweets.";"2013";"Li Dong|Furu Wei|Yajuan Duan|Xiaohua Liu|Ming Zhou|Ke Xu";"6";"2016-09-05 08:35:58";"The Automated Acquisition of Suggestions from Tweets. L Dong, F Wei, Y Duan, X Liu, M Zhou, K Xu - AAAI, 2013 - pdfs.semanticscholar.org. Abstract This paper targets at automatically detecting and classifying user's suggestions  from tweets. The short and informal nature of tweets, along with the imbalanced  characteristics of suggestion tweets, makes the task extremely challenging. To this end,  .."
"629";"Towards Cohesive Anomaly Mining.";"2013";"Yun Xiong|Yangyong Zhu|Philip S. Yu|Jian Pei";"5";"2016-06-18 13:53:25";"Towards Cohesive Anomaly Mining. Y Xiong, Y Zhu, SY Philip, J Pei - AAAI, 2013 - cs.sfu.ca. Abstract In some applications, such as bioinformatics, social network analysis, and  computational criminology, it is desirable to find compact clusters formed by a (very) small  portion of objects in a large data set. Since such clusters are comprised of a small number  .."
"630";"WordNet Based Multi-Way Concept Hierarchy Construction from Text Corpus.";"2013";"Ding Tu|Ling Chen|Gencai Chen";"2";"2016-09-05 05:21:43";"Wordnet based multi-way concept hierarchy construction from text corpus. LC Ding Tu, G Chen - Twenty-Seventh AAAI Conference  , 2013 - pdfs.semanticscholar.org. Abstract In this paper, we propose an approach to build a multi-way concept hierarchy from  a text corpus, which is based on WordNet and multi-way hierarchical clustering. In addition,  a new evaluation metric is presented, and our approach is compared with 4 kinds of  .."
"631";"A First-Order Logic Based Framework for Verifying Simulations.";"2013";"Hui Meen Nyew|Nilufer Onder|Soner &Ouml;nder|Zhenlin Wang";"0";"2016-06-18 13:53:05";"A First-Order Logic Based Framework for Verifying Simulations. HM Nyew, N Onder, S Önder, Z Wang - AAAI, 2013 - cs.mtu.edu. Abstract Modern science relies on simulation techniques for understanding phenomenon,  exploring design options, or evaluating models. Assuring the correctness of simulators is a  key problem where a multitude of solutions ranging from manual inspection to formal  .."
"632";"Multiagent Learning with a Noisy Global Reward Signal.";"2013";"Scott Proper|Kagan Tumer";"1";"2016-06-18 13:53:47";"Multiagent Learning with a Noisy Global Reward Signal. S Proper, K Tumer - AAAI, 2013 - engr.oregonstate.edu. Abstract Scaling multiagent reinforcement learning to domains with many agents is a  complex problem. In particular, multiagent credit assignment becomes a key issue as the  system size increases. Some multiagent systems suffer from a global reward signal that is  .."
"633";"Agent Cooperatives for Effective Power Consumption Shifting.";"2013";"Charilaos Akasiadis|Georgios Chalkiadakis";"20";"2016-09-05 04:53:42";"Agent Cooperatives for Effective Power Consumption Shifting. C Akasiadis, G Chalkiadakis - AAAI, 2013 - pdfs.semanticscholar.org. Abstract In this paper, we present a directly applicable scheme for electricity consumption  shifting and effective demand curve flattening. The scheme can employ the services of either  individual or cooperating consumer agents alike. Agents participating in the scheme,  .."
"634";"Assumption-Based Planning: Generating Plans and Explanations under Incomplete Knowledge.";"2013";"Sammy Davis-Mendelow|Jorge A. Baier|Sheila A. McIlraith";"5";"2016-06-18 13:53:15";"Assumption-Based Planning: Generating Plans and Explanations under Incomplete Knowledge. S Davis-Mendelow, JA Baier, SA McIlraith - AAAI, 2013 - cs.toronto.edu. Abstract Many practical planning problems necessitate the generation of a plan under  incomplete information about the state of the world. In this paper we propose the notion of  Assumption-Based Planning. Unlike conformant planning, which attempts to find a plan  .."
"635";"Large-Scale Hierarchical Classification via Stochastic Perceptron.";"2013";"Dehua Liu|Bojun Tu|Hui Qian|Zhihua Zhang";"1";"2016-06-18 13:53:05";"Large-Scale Hierarchical Classification via Stochastic Perceptron. D Liu, B Tu, H Qian, Z Zhang - AAAI, 2013 - cs.zju.edu.cn. Abstract Hierarchical classification (HC) plays an significant role in machine learning and  data mining. However, most of the state-of-the-art HC algorithms suffer from high  computational costs. To improve the performance of solving, we propose a stochastic  .."
"636";"How to Cut a Cake Before the Party Ends.";"2013";"David Kurokawa|John K. Lai|Ariel D. Procaccia";"20";"2016-09-05 04:53:19";"How to Cut a Cake Before the Party Ends. D Kurokawa, JK Lai, AD Procaccia - AAAI, 2013 - aaai.org. Abstract For decades researchers have struggled with the problem of envy-free cake cutting:  how to divide a divisible good between multiple agents so that each agent likes his own  allocation best. Although an envy-free cake cutting protocol was ultimately devised, it is  .."
"637";"Answering Counting Aggregate Queries over Ontologies of the DL-Lite Family.";"2013";"Egor V. Kostylev|Juan L. Reutter";"9";"2016-06-18 13:52:55";"Answering Counting Aggregate Queries over Ontologies of the DL-Lite Family. EV Kostylev, JL Reutter - AAAI, 2013 - ing.puc.cl. Abstract One of the main applications of description logics is the ontology-based data  access model, which requires algorithms for query answering over ontologies. In fact, some  description logics, like those in the DL-Lite family, are designed so that simple queries,  .."
"638";"Trading Space for Time in Grid-Based Path Finding.";"2013";"William Lee|Ramon Lawrence";"2";"2016-06-18 13:53:47";"Trading Space for Time in Grid-Based Path Finding. W Lee, R Lawrence - AAAI, 2013 - db.ok.ubc.ca. Abstract Grid-based path finding is required in many games to move agents. We present an  algorithm called DBA* that uses a database of pre-computed paths to reduce the time to  solve search problems. When evaluated using benchmark maps from Dragon AgeTM,  .."
"639";"Multi-Target Detection and Recognition by UAVs Using Online POMDPs.";"2013";"Caroline Ponzoni Carvalho Chanel|Florent Teichteil-K&ouml;nigsbuch|Charles Lesire";"13";"2016-09-05 04:55:54";"Multi-Target Detection and Recognition by UAVs Using Online POMDPs. CPC Chanel, F Teichteil-Königsbuch, C Lesire - AAAI, 2013 - pdfs.semanticscholar.org. Abstract This paper tackles high-level decision-making techniques for robotic missions,  which involve both active sensing and symbolic goal reaching, under uncertain probabilistic  environments and strong time constraints. Our case study is a POMDP model of an online  .."
"640";"Unsupervised Cluster Matching via Probabilistic Latent Variable Models.";"2013";"Tomoharu Iwata|Tsutomu Hirao|Naonori Ueda";"5";"2016-06-18 13:53:15";"Unsupervised Cluster Matching via Probabilistic Latent Variable Models. T Iwata, T Hirao, N Ueda - AAAI, 2013 - Citeseer. Abstract We propose a probabilistic latent variable model for unsupervised cluster matching,  which is the task of finding correspondences between clusters of objects in different  domains. Existing object matching methods find oneto-one matching. The proposed  .."
"641";"Automatic Extraction of Efficient Axiom Sets from Large Knowledge Bases.";"2013";"Abhishek B. Sharma|Kenneth D. Forbus";"5";"2016-06-18 13:53:15";"Automatic Extraction of Efficient Axiom Sets from Large Knowledge Bases. AB Sharma, KD Forbus - AAAI, 2013 - qrg.northwestern.edu. Abstract Efficient reasoning in large knowledge bases is an important problem for AI  systems. Hand-optimization of reasoning becomes impractical as KBs grow, and impossible  as knowledge is automatically added via knowledge capture or machine learning. This  .."
"642";"Dynamic Minimization of Sentential Decision Diagrams.";"2013";"Arthur Choi|Adnan Darwiche";"20";"2016-09-05 04:53:09";"Dynamic Minimization of Sentential Decision Diagrams. A Choi, A Darwiche - AAAI, 2013 - pdfs.semanticscholar.org. Abstract The Sentential Decision Diagram (SDD) is a recently proposed representation of  Boolean functions, containing Ordered Binary Decision Diagrams (OBDDs) as a  distinguished subclass. While OBDDs are characterized by total variable orders, SDDs  .."
"643";"Introducing Nominals to the Combined Query Answering Approaches for EL.";"2013";"Giorgio Stefanoni|Boris Motik|Ian Horrocks";"27";"2016-06-18 08:25:18";"Introducing nominals to the combined query answering approaches for EL. G Stefanoni, B Motik, I Horrocks - arXiv preprint arXiv:1303.7430, 2013 - arxiv.org. Abstract: So-called combined approaches answer a conjunctive query over a description  logic ontology in three steps: first, they materialise certain consequences of the ontology and  the data; second, they evaluate the query over the data; and third, they filter the result of  .."
"644";"Graphical Model-Based Learning in High Dimensional Feature Spaces.";"2013";"Zhao Song|Yuke Zhu";"1";"2016-06-18 13:53:05";"Graphical Model-Based Learning in High Dimensional Feature Spaces. Z Song, Y Zhu - AAAI, 2013 - stanford.edu. Abstract Digital media tend to combine text and images to express richer information,  especially on image hosting and online shopping websites. This trend presents a challenge  in understanding the contents from different forms of information. Features representing  .."
"645";"Model Predictive Control with Uncertainty in Human Driven Systems.";"2013";"Alexander David Styler|Illah Reza Nourbakhsh";"5";"2016-09-05 08:52:59";"Model Predictive Control with Uncertainty in Human Driven Systems. AD Styler, IR Nourbakhsh - AAAI, 2013 - pdfs.semanticscholar.org. Abstract Human driven systems present a unique optimization challenge for robot control.  Generally, operators of these systems behave rationally given environmental factors and  desired goals. However, information available to subsystem controllers is often incomplete .."
"646";"AAAI Organization.";"2013";;"0";"2012-12-31 23:00:00";NULL
"647";"The Role of Complex Network Dynamics in the Emergence of Multiagent Coalition.";"2013";"Mohammad Rashedul Hasan|Anita Raja";"0";"2016-09-05 05:37:51";"The Role of Complex Network Dynamics in the Emergence of Multiagent Coalition. MR Hasan, A Raja - AAAI, 2013 - engfac.cooper.edu. Abstract Emergence of a single coalition among self-interested agents operating on large  scale-free networks is a challenging task. Many existing approaches assume a given static  network platform and do not use the network dynamics to facilitate the dynamics of agent  .."
"648";"Video Saliency Detection via Dynamic Consistent Spatio-Temporal Attention Modelling.";"2013";"Sheng-hua Zhong|Yan Liu|Feifei Ren|Jinghuan Zhang|Tongwei Ren";"18";"2016-09-05 04:54:37";"Video Saliency Detection via Dynamic Consistent Spatio-Temporal Attention Modelling. S Zhong, Y Liu, F Ren, J Zhang, T Ren - AAAI, 2013 - researchgate.net. Abstract Human vision system actively seeks salient regions and movements in video  sequences to reduce the search effort. Modeling computational visual saliency map  provides important information for semantic understanding in many real world applications .."
"649";"The Wisdom of Crowds in Bioinformatics: What Can We Learn (and Gain) from Ensemble Predictions?";"2013";"Mariana Recamonde Mendoza|Ana L&uacute;cia C. Bazzan";"0";"2016-06-18 13:53:15";"The Wisdom of Crowds in Bioinformatics: What Can We Learn (and Gain) from Ensemble Predictions?. MR Mendoza, ALC Bazzan - AAAI, 2013 - pdfs.semanticscholar.org. Abstract The combination of distinct algorithms expertise to improve prediction accuracy,  inspired by the theory of wisdom of crowds, has been increasingly discussed in literature.  However, its application to bioinformatics-related tasks is still in its infancy. This thesis  .."
"650";"Enforcing Meter in Finite-Length Markov Sequences.";"2013";"Pierre Roy|Fran&ccedil;ois Pachet";"15";"2016-09-05 04:55:54";"Enforcing Meter in Finite-Length Markov Sequences. P Roy, F Pachet - AAAI, 2013 - csl.sony.fr. Abstract Markov processes are increasingly used to generate finitelength sequences that  imitate a given style. However, Markov processes are notoriously difficult to control.  Recently, Markov constraints have been introduced to give users some control on  .."
"651";"Robust Bidirectional Search via Heuristic Improvement.";"2013";"Christopher Makoto Wilt|Wheeler Ruml";"0";"2016-06-18 13:53:47";"Robust Bidirectional Search via Heuristic Improvement. CM Wilt, W Ruml - AAAI, 2013 - cs.unh.edu. Abstract Although the heuristic search algorithm A* is well-known to be optimally efficient,  this result explicitly assumes forward search. Bidirectional search has long held promise for  surpassing A*'s efficiency, and many varieties have been proposed, but it has proven  .."
"652";"Story Generation with Crowdsourced Plot Graphs.";"2013";"Boyang Li|Stephen Lee-Urban|George Johnston|Mark Riedl";"42";"2016-09-05 04:50:46";"Story Generation with Crowdsourced Plot Graphs. B Li, S Lee-Urban, G Johnston, M Riedl - AAAI, 2013 - boyangli.co. Abstract Story generation is the problem of automatically selecting a sequence of events that  meet a set of criteria and can be told as a story. Story generation is knowledge-intensive;  traditional story generators rely on a priori defined domain models about fictional worlds,  .."
"653";"An Optimal Task Assignment Policy and Performance Diagnosis Strategy for Heterogeneous Hadoop Cluster.";"2013";"Shekhar Gupta";"0";"2016-09-05 07:50:20";"An Optimal Task Assignment Policy and Performance Diagnosis Strategy for Heterogeneous Hadoop Cluster. S Gupta - AAAI, 2013 - pdfs.semanticscholar.org. Abstract The goal of the proposed research is to improve the performance of Hadoop-based  software running on a heterogeneous cluster. My approach lies in the intersection of  machine learning, scheduling and diagnosis. We mainly focus on heterogeneous Hadoop  .."
"654";"Information Sharing Under Costly Communication in Joint Exploration.";"2013";"Igor Rochlin|David Sarne";"5";"2016-06-18 13:53:36";"Information Sharing Under Costly Communication in Joint Exploration. I Rochlin, D Sarne - AAAI, 2013 - cs.biu.ac.il. Abstract This paper studies distributed cooperative multi-agent exploration methods in  settings where the exploration is costly and the overall performance measure is determined  by the minimum performance achieved by any of the individual agents. Such an  .."
"655";"Multiple Hypothesis Object Tracking For Unsupervised Self-Learning: An Ocean Eddy Tracking Application.";"2013";"James H. Faghmous|Muhammed Uluyol|Luke Styles|Matthew Le|Varun Mithal|Shyam Boriah|Vipin Kumar";"6";"2016-06-18 13:53:25";"Multiple Hypothesis Object Tracking For Unsupervised Self-Learning: An Ocean Eddy Tracking Application. JH Faghmous, M Uluyol, L Styles, M Le, V Mithal - AAAI, 2013 - Citeseer. Abstract Mesoscale ocean eddies transport heat, salt, energy, and nutrients across oceans.  As a result, accurately identifying and tracking such phenomena are crucial for  understanding ocean dynamics and marine ecosystem sustainability. Traditionally, ocean  .."
"656";"Convex Subspace Representation Learning from Multi-View Data.";"2013";"Yuhong Guo";"22";"2016-09-05 04:52:50";"Convex Subspace Representation Learning from Multi-View Data. Y Guo - AAAI, 2013 - cis-linux1.temple.edu. Abstract Learning from multi-view data is important in many applications. In this paper, we  propose a novel convex subspace representation learning method for unsupervised multi- view clustering. We first formulate the subspace learning with multiple views as a joint  .."
"657";"A Topic-Based Coherence Model for Statistical Machine Translation.";"2013";"Deyi Xiong|Min Zhang 0005";"15";"2016-09-05 04:54:38";"A Topic-Based Coherence Model for Statistical Machine Translation. D Xiong, M Zhang - AAAI, 2013 - pdfs.semanticscholar.org. Abstract Coherence that ties sentences of a text into a meaningfully connected structure is of  great importance to text generation and translation. In this paper, we propose a topic-based  coherence model to produce coherence for document translation, in terms of the continuity  .."
"658";"Conference Committees.";"2013";;"0";"2012-12-31 23:00:00";NULL
"659";"Heuristic Search for Large Problems with Real Costs.";"2013";"Matthew Hatem";"6";"2016-09-05 08:14:07";"Heuristic Search for Large Problems With Real Costs. M Hatem, E Burns, W Ruml - AAAI, 2011 - matthatem.com. Abstract The memory requirements of basic best-first heuristic search algorithms like A*  make them infeasible for solving large problems. External disk storage is cheap and plentiful  compared to the cost of internal RAM. Unfortunately, state-ofthe-art external memory  .."
"660";"A Tractable Leader-Follower MDP Model for Animal Disease Management.";"2013";"R&eacute;gis Sabbadin|Anne-France Viet";"0";"2016-09-05 08:47:33";"A Tractable Leader-Follower MDP Model for Animal Disease Management. R Sabbadin, AF Viet - AAAI, 2013 - pdfs.semanticscholar.org. Abstract Sustainable animal disease management requires to design and implement control  policies at the regional scale. However, for diseases which are not regulated, individual  farmers are responsible for the adoption and successful application of control policies at  .."
